{
  "id": "CA-2024-11",
  "date": "2024-03-12",
  "text": "CA 2024/11. Examplia Court of Appeal, Labour Chamber. The employer dismissed the claimant by telephone. Held: a dismissal that is not given in writing is void. The employer must reinstate the employee or pay compensation of at least four months' wages, at the employee's choice.",
  "jurisdiction": "xx",
  "court": "Court of Appeal of Examplia"
}
