{
  "id": "CA-2021-19",
  "date": "2021-09-14",
  "text": "CA 2021/19. Examplia Court of Appeal, Labour Chamber. Held: a clause forbidding an employee to work for a competitor after leaving binds the employee only when the employer pays compensation for the restricted period. Without compensation the clause is unenforceable.",
  "jurisdiction": "xx",
  "court": "Court of Appeal of Examplia"
}
