{
  "id": "CA-2023-07",
  "date": "2023-06-02",
  "text": "CA 2023/07. Examplia Court of Appeal, Labour Chamber. The claimant was dismissed in the second month of a three-month probation period. Held: during an agreed probation period of at most three months either party may end the contract without giving a reason. Notice of one week is still owed.",
  "jurisdiction": "xx",
  "court": "Court of Appeal of Examplia"
}
