{
  "id": "CA-2024-02",
  "date": "2024-01-30",
  "text": "CA 2024/02. Examplia Court of Appeal, Labour Chamber. The claimant resigned after their pay was withheld for three months. Held: a resignation the employer forced by a serious breach is treated as a dismissal by the employer, and the employee keeps every claim a dismissed employee has.",
  "jurisdiction": "xx",
  "court": "Court of Appeal of Examplia"
}
