{
  "id": "court-of-appeal-2024-0187",
  "jurisdiction": "GB",
  "court": "Court of Appeal (Civil Division)",
  "date": "2024-05-17",
  "text": "The appeal is allowed. The judge below did not apply the statutory test ...",
  "level": "appellate",
  "metadata": {"neutral_citation": "[2024] EWCA Civ 187"},
  "extensions": {"example.com": {"collection": "employment"}}
}
