{
  "id": "CA-2022-31",
  "date": "2022-11-21",
  "text": "CA 2022/31. Examplia Court of Appeal, Labour Chamber. The claimant sought pay for overtime worked over six years. Held: a claim for overtime pay is barred five years after the pay day on which it fell due. Only the last five years may be recovered.",
  "jurisdiction": "xx",
  "court": "Court of Appeal of Examplia"
}
